{
  "schema": "srh.client-intake.v1",
  "id": "construction-tenders-pilot",
  "name": "Ufficio gare — analisi capitolati e bozze",
  "description": "Pilot on-premises for tender document analysis with grounded answers and draft preparation.",
  "workload_class": "mixed",
  "reasoning": "disabled",
  "traffic": {
    "total_users": 8,
    "concurrent_users": 4,
    "requests_per_day": 20,
    "peak_requests_per_minute": 2,
    "burst_factor": 2
  },
  "documents": {
    "context_mode": "retrieval",
    "pages": {"p50": 80, "p95": 250, "max": 500},
    "retrieved_pages": {"p50": 8, "p95": 20, "max": 40},
    "scanned_fraction": 0.3,
    "shared_prefix_probability": 0.4,
    "repeated_context_probability": 0.3
  },
  "responses": {
    "words": {"p50": 400, "p95": 1200, "max": 2000}
  },
  "experience": {
    "first_useful_response_seconds": 5,
    "complete_response_seconds": 60,
    "error_rate_max": 0.01
  },
  "quality": {
    "grounding_required": true,
    "citation_required": true,
    "structured_output_required": true,
    "minimum_score": 0.95
  },
  "deployment": {
    "data_residency": "on-premises",
    "maximum_device_power_w": 750
  },
  "exploration": {
    "hardware_ids": [
      "nvidia-gb10-128gb",
      "nvidia-rtx-pro-6000-blackwell-96gb",
      "nvidia-h100-sxm-80gb"
    ],
    "model_ids": [
      "dense-8b-class",
      "dense-32b-class",
      "dense-70b-class",
      "moe-120b-12b-active-class"
    ],
    "requested_model_families": ["Qwen", "DeepSeek", "Llama"],
    "weight_bits": [4, 8]
  },
  "translation_assumptions": {
    "words_per_page": 450,
    "tokens_per_word": 1.34,
    "prompt_overhead_tokens": 256
  }
}
